{
  "$schema": "https://json-schema.org/draft/2020-12/schema",
  "$id": "https://github.com/metadatastician/universal-modding-studio/blob/main/schemas/dlc-manifest.schema.json",
  "title": "Universal Modding Studio package manifest",
  "description": "Capability-aware envelope for a UMS-produced package. Legacy IDApTIK v1 kinds remain accepted for migration compatibility.",
  "type": "object",
  "required": ["id", "name", "version", "description", "license", "kind"],
  "additionalProperties": false,
  "properties": {
    "$schema": { "type": "string" },
    "manifest-version": { "const": 2 },
    "profile": {
      "type": "string",
      "pattern": "^[a-z0-9][a-z0-9.-]*$",
      "description": "Profile that owns payload semantics."
    },
    "id": {
      "type": "string",
      "pattern": "^[a-z0-9][a-z0-9-]*$",
      "description": "Stable lowercase-kebab identifier, unique across installed DLC."
    },
    "name": { "type": "string", "minLength": 1 },
    "version": {
      "type": "string",
      "pattern": "^\\d+\\.\\d+\\.\\d+(-[0-9A-Za-z.-]+)?(\\+[0-9A-Za-z.-]+)?$",
      "description": "Semantic version."
    },
    "description": { "type": "string", "minLength": 1 },
    "license": { "type": "string", "minLength": 1, "description": "SPDX license expression." },
    "author": { "type": "string" },
    "kind": {
      "enum": [
        "scenario",
        "campaign",
        "content-pack",
        "ruleset",
        "generator",
        "presentation-pack",
        "compatibility-patch",
        "studio-extension",
        "edit-script",
        "gameplay-mechanic",
        "puzzle-pack",
        "scenario-definition",
        "actor-pack",
        "asset-pack"
      ],
      "description": "Broad package classification. gameplay-mechanic, puzzle-pack, scenario-definition, actor-pack and asset-pack are retained v1 compatibility aliases; profile-owned payload contracts define their internal meaning."
    },
    "loads": {
      "type": "string",
      "description": "Load point hint for the game loader (e.g. on-puzzle-screen, on-scenario-select)."
    },
    "exports": {
      "type": "object",
      "additionalProperties": { "type": "string" },
      "description": "Named entry points the payload exposes."
    },
    "depends-on": {
      "type": "object",
      "additionalProperties": { "type": "string" },
      "description": "Dependency name to semver range."
    },
    "compile-target": { "enum": ["wasmgc", "wasm32", "none"] },
    "wasm-modules": {
      "type": "array",
      "items": { "type": "string" },
      "description": "Paths (relative to the manifest) of compiled modules."
    },
    "payload": {
      "type": "object",
      "required": ["format", "path"],
      "additionalProperties": false,
      "properties": {
        "format": {
          "type": "string",
          "pattern": "^[a-z0-9][a-z0-9-]*-[a-z0-9-]+/\\d+$",
          "description": "Profile-owned payload wire-format tag, e.g. idaptik-scenario/1 or idaptik-edit/1. Versioned independently of the manifest."
        },
        "path": { "type": "string", "description": "Payload file relative to the manifest." }
      },
      "description": "Where a profile-owned typed payload lives."
    },
    "guarantees": {
      "type": "array",
      "items": { "type": "string" },
      "description": "Claim tags backed by verification evidence. A tag is not implicitly a machine-checked proof."
    },
    "verification": {
      "type": "object",
      "additionalProperties": { "type": "string" },
      "description": "Pointers to the evidence for each guarantee (test suites, soundness docs)."
    },
    "provides": {
      "type": "array",
      "uniqueItems": true,
      "items": {
        "type": "string",
        "pattern": "^[a-z0-9][a-z0-9-]*(\\.[a-z0-9][a-z0-9-]*)+$"
      },
      "description": "Namespaced capabilities supplied by this package."
    },
    "patches": {
      "type": "array",
      "uniqueItems": true,
      "items": {
        "type": "string",
        "pattern": "^[a-z0-9][a-z0-9-]*(\\.[a-z0-9][a-z0-9-]*)+$"
      },
      "description": "Namespaced capabilities this package modifies."
    }
  }
}
